### ISSUE TITLE
pod IP 直接对外暴露

### ISSUE THREAD

**Issue by AEGQ** [alauda/kube-ovn#142]
背景：
kube-ovn v0.8.0，参考 [Pod IP 直接对外暴露](https://github.com/alauda/kube-ovn/wiki/Pod-IP-%E7%9B%B4%E6%8E%A5%E5%AF%B9%E5%A4%96%E6%9A%B4%E9%9C%B2) 文档验证集群外节点访问pod ip功能

现象：
1、gatewayType=distributed，natOutgoing=false : 
集群外部节点添加pod所在节点路由才可以ping通，并且不能ping通其他节点的pod IP

2、gatewayType=centralized，natOutgoing=false : 
集群外部节点任一节点路由，都不能ping pod IP

咨询:
请问除了文档中的配置，还有其他需要注意的地方么。

---
### 集群
```
NAME             STATUS    ROLES     AGE       VERSION   LABELS
192.168.56.101   Ready     master    1y        v1.11.2   beta.kubernetes.io/arch=amd64,beta.kubernetes.io/os=linux,kube-ovn/role=master,kubernetes.io/hostname=192.168.56.101,kubernetes.io/role=master
192.168.56.103   Ready     master    58d       v1.11.2   beta.kubernetes.io/arch=amd64,beta.kubernetes.io/os=linux,kubernetes.io/hostname=192.168.56.103,kubernetes.io/role=master
192.168.56.104   Ready     master    1y        v1.11.2   beta.kubernetes.io/arch=amd64,beta.kubernetes.io/os=linux,kubernetes.io/hostname=192.168.56.104,kubernetes.io/role=master

```

### subnet
```
NAME             PROTOCOL   CIDR            PRIVATE   NAT       DEFAULT   GATEWAYTYPE   USED      AVAILABLE
join             IPv4       192.20.0.0/16   false     false     false     distributed   3         65532
ovn-default      IPv4       172.20.0.0/16   false     true      true      distributed   5         65530
subnet-gateway   IPv4       172.30.0.0/16   false     false     false     distributed   2         65533
```
### subnet-gateway
```
Name:         subnet-gateway
Namespace:    
Labels:       <none>
Annotations:  kubectl.kubernetes.io/last-applied-configuration={"apiVersion":"kubeovn.io/v1","kind":"Subnet","metadata":{"annotations":{},"name":"subnet-gateway","namespace":""},"spec":{"cidrBlock":"172.30.0.0/16",...
API Version:  kubeovn.io/v1
Kind:         Subnet
Metadata:
  Creation Timestamp:  2019-11-15T02:11:57Z
  Generation:          3
  Resource Version:    10881313
  Self Link:           /apis/kubeovn.io/v1/subnets/subnet-gateway
  UID:                 4cdbe95a-074d-11ea-b87c-0800273dab21
Spec:
  Cidr Block:  172.30.0.0/16
  Default:     false
  Exclude Ips:
    172.30.0.1
  Gateway:       172.30.0.1
  Gateway Type:  distributed
  Namespaces:
    default
  Nat Outgoing:  false
  Private:       false
  Protocol:      IPv4

```
### pod [default namespace]
```
NAME                      READY     STATUS    RESTARTS   AGE       IP           NODE             NOMINATED NODE
nginx-64f497f8fd-bw75b    1/1       Running   0          6m        172.30.0.2   192.168.56.103   <none>
nginx1-846d65cc74-gwbfd   1/1       Running   0          6m        172.30.0.3   192.168.56.104   <none>

```

### 集群外部节点
```
172.30.0.0      192.168.56.104  255.255.0.0     UG    0      0        0 enp0s8


[root@localhost ~]# curl 172.30.0.2
^C
[root@localhost ~]# curl 172.30.0.3
<!DOCTYPE html>
<html>
<head>
<title>Welcome to nginx!</title>
<style>
    body {
        width: 35em;
        margin: 0 auto;
        font-family: Tahoma, Verdana, Arial, sans-serif;
    }
</style>
</head>
<body>
<h1>Welcome to nginx!</h1>
<p>If you see this page, the nginx web server is successfully installed and
working. Further configuration is required.</p>

<p>For online documentation and support please refer to
<a href="http://nginx.org/">nginx.org</a>.<br/>
Commercial support is available at
<a href="http://nginx.com/">nginx.com</a>.</p>

<p><em>Thank you for using nginx.</em></p>
</body>
</html>

```

**Comment by oilbeater** [comment]
node 节点上需要开启 ip_forward
如果还是不通需要用 tcpdump 抓一下包看看数据报文到了哪一步没有继续下去

**Comment by AEGQ** [comment]
> 前提： gatewayType=distributed，natOutgoing=false,private=false

> 进入到非路由节点所在的pod 中，能看到有收到并反回包，但 pod  中 ping 不通外部主机（包括www.baidu.com），只能ping 通集群其他主机IP （private 为 false）
```
### pod 中tcpdump 有 request和reply包

 / # tcpdump -n -i any 
07:16:05.985557 IP 192.168.56.100 > 172.30.0.8: ICMP echo request, id 4792, seq 10, length 64
07:16:05.985581 IP 172.30.0.8 > 192.168.56.100: ICMP echo reply, id 4792, seq 10, length 64
07:16:06.985347 IP 192.168.56.100 > 172.30.0.8: ICMP echo request, id 4792, seq 11, length 64
07:16:06.985370 IP 172.30.0.8 > 192.168.56.100: ICMP echo reply, id 4792, seq 11, length 64
^C
24 packets captured
24 packets received by filter
0 packets dropped by kernel

### ping 外部主机 不通

/ # ping 192.168.56.100
PING 192.168.56.100 (192.168.56.100): 56 data bytes

^C
--- 192.168.56.100 ping statistics ---
3 packets transmitted, 0 packets received, 100% packet loss

### ping 集群其他主机

/ # ping 192.168.56.101
PING 192.168.56.101 (192.168.56.101): 56 data bytes
64 bytes from 192.168.56.101: seq=0 ttl=63 time=1.362 ms
64 bytes from 192.168.56.101: seq=1 ttl=63 time=1.607 ms
64 bytes from 192.168.56.101: seq=2 ttl=63 time=0.146 ms

```

**Comment by oilbeater** [comment]
@AEGQ 刚刚测了下怀疑是分布式网关的情况下 ovs 会 drop 非对称路由下的数据包，可以选择集中式网关，外部路由的下一跳指向网关节点。
这种情况下需要重建之前该子网的 pod 新的路由规则才会生效

**Comment by oilbeater** [comment]
by the way, 我们在做类似 calico bgp 那样的对外声明路由信息的功能，有了这个功能可以不需要再配置静态路由

**Comment by AEGQ** [comment]
好的，谢谢，我测试一下 :)

> 一直在用 calico，但是很需要 一个 pod IP 直接对外暴露的功能，所以做了这个[测试](https://www.jianshu.com/p/19dca91c71ce) ,但看到 kube-ovn支持，所以想学习验证一下 :)

**Comment by oilbeater** [comment]
@AEGQ 修改了一下 ovn 的代码，处理非对称路由下丢包的问题，可以把ovn-central 的 镜像换成index.alauda.cn/alaudak8s/kube-ovn-db:dev133 试一下

**Comment by AEGQ** [comment]
> gatewayType: distributed ,  natOutgoing: false

使用了 index.alauda.cn/alaudak8s/kube-ovn-db:dev133 镜像 ，外部节点配置集群内任一节点路由 **都可以** 访问集群所有pod IP。

已经解决，感谢回复 :)
